,id,name,address,coor,city,phone,website,email,description,charity_number,company_number,Monday,Tuesday,Wednesday,Thursday,Friday,Saturday,Sunday
0,e8a668c8-e6e3-445c-8430-ec553c3a537e,Edinburgh Play and Wellbeing,EH11 4RU,"(55.922364, -3.27788685)",Edinburgh,07511533432,,edinburghplayandwellbeing@gmail.com,"Edinburgh Play and Wellbeing has been set up and aim is to offer support for vulnerable people, on an individual person-centre.  Member of The College Guild of Graduates Register Diploma in Bereavement and Grief Counselling.",SC050635,,09:00 – 17:00,09:00 – 17:00,09:00 – 17:00,09:00 – 17:00,09:00 – 17:00,09:00 – 12:00,Closed
1,eb576c74-9f28-4530-b167-883ce4ea8e19,Signpost NENC,"Cumbria,CA1","(54.88464234999999, -2.904537)",Carlisle,,https://www.signpostnenc.co.uk/,,"A mental health and well-being signposting site for everyone across the North East and North Cumbria.  We all know mental health and wellbeing is a vital part of all our lives that requires some looking after from time to time. That’s why we’re here. To collect all the worthwhile resources and put them in one, easy to navigate website for all",,,24 Hours,24 Hours,24 Hours,24 Hours,24 Hours,24 Hours,24 Hours
2,1ed32ad9-cf39-60a6-aebf-39261b4ff50b,Togetherall (Scotland),"Scotland,AB12","(57.087770250000005, -2.172326)",Aberdeen,02034056196,https://togetherall.com/en-gb/free-mental-health-support-for-your-community-in-scotland/,theteam@togetherall.com,"Available via participating Scottish councils, Togetherall is a safe, online community where people support each other anonymously to improve mental health and wellbeing.  Togetherall is currently available in the following areas:  Supporting Young people:  Orkney Islands Council - 16 – 19 years of age Glasgow City Council - 16 – 24 years of age Tayside – Angus, Dundee, Perth & Kinross Councils - 16 – 24 years of age West Dunbartonshire Council - 16 – 24 years of age East Renfrewshire Council - 16 – 25 years of age Renfrewshire Council - 16 – 25 years of age South Ayrshire Council - 16 – 25 years of age Clackmannanshire Council - 16 – 26 years of age Falkirk Council - 16 – 26 years of age Fife Council - 16 – 26 years of age Stirling Council - 16 – 26 years of age  Supporting people of all ages: Aberdeenshire Council - Ages 16+ Scottish Borders Council - Ages 16+  Information sourced from website: https://togetherall.com/en-gb/free-mental-health-support-for-your-community-in-scotland/",,06227377,24 Hours,24 Hours,24 Hours,24 Hours,24 Hours,24 Hours,24 Hours
3,1ecf088b-8782-6baa-939f-698fdcc7fcbf,Lifelink,"Lifelink, Suite 4, Melisa House,Brand Place,Glasgow,G51 1DR","(55.8538664, -4.300003799999999)",Glasgow,01415524434,https://www.lifelink.org.uk/,info@lifelink.org.uk,"Lifelink can offer support to anyone who is struggling to cope with everyday stress or is feeling anxious or depressed. Issues such as debt, bereavement, addiction, self-harm/suicide and problems with relationships or family can all interfere with a persons’ quality and experience of life.  Talking things through in a safe and confidential space can help you understand how you are feeling and can help you develop effective ways of coping with challenges you may face.  Lifelink's one to one support gives young people the opportunity to discuss any issues that may be affecting them. Our counsellors will work on ways to overcome any difficulties they have so that they can go back to feeling positive again.  Information sourced from website: https://www.lifelink.org.uk/how-we-can-help/adults/",SC025643,171155,09:00 – 17:00,09:00 – 17:00,09:00 – 17:00,09:00 – 17:00,09:00 – 17:00,09:30 – 12:30,Closed
4,1eccf860-c3ff-6e8a-a89d-27e2f62444e6,Rainbow House,"Rainbow House,21a Westland Drive,Glasgow,G14 9NY","(55.8776462, -4.339438299999999)",Glasgow,01419501772,https://www.crossreach.org.uk/,,Offering mental health support and advice.  Also offering counselling.  Information sourced from website: https://www.scottishdrugservices.com/,SC0011353,,24 Hours,24 Hours,24 Hours,24 Hours,24 Hours,24 Hours,24 Hours
5,149b834e-949b-4447-8c79-99c64518d4a2,"Always Another Way, Cumbria","Frizington Youth Club, Off Church Street,Frizington,Cumbria,CA26 3SS","(54.538241450000015, -3.49600735)",Frizington,07548342527,https://www.alwaysanotherway.co.uk/,info@alwaysanotherway.co.uk,"We provide a weekly mental health drop in and also one to one support.   Some of face to face sessions will be taking place at this address, such as the LGBTQ youth group. Our other sessions are taking place in various venues, for further information about venues for particular groups and services please visit our website or contact via email or mobile.",,10238699,09:00 – 17:00,09:00 – 17:00,09:00 – 17:00,09:00 – 17:00,09:00 – 17:00,12:00 – 15:00,Closed
6,1eccc5b0-5318-6542-a445-0dd6d60ea2fc,Berwick Youth Project,"9-12 Golden Square,Berwick-upon-Tweed,Northumberland,TD15 1BG","(55.769783099999984, -2.0060039)",Berwick-upon-Tweed,01289333100,https://berwickyouthproject.co.uk/,info@berwickyouthproject.co.uk,"We have a wide range of services, offering different things to different people, who have different needs at different times. For some young people that we work with we provide a safe place to be and a source of practical and emotional help.  For some, it’s a fun place to meet with challenging activities in the evenings and holidays. For others, we offer accommodation and support. And of course, for some young people, it can be all of these things!  And we’re always looking for your suggestions about what you want! Berwick Youth Project is available to ALL young people aged 13 – 25 years, living in the Berwick area.",1166598,,09:00 – 17:00,09:00 – 17:00,09:00 – 17:00,09:00 – 17:00,09:00 – 17:00,Closed,Closed
7,74e9f336-b9dd-43e3-b042-6f6de02ddbe0,Jean's Bothy,"102 East King Street,Helensburgh,G84 7RG","(56.00180859999999, -4.715497000000001)",Helensburgh,07542226390,https://www.jeansbothy.org/,jeansbothy@enable.org.uk,Mental Health & Wellbeing hub offering therapeutic activities and workshops aswell as 1-2-1 phone support during Monday - Friday 10am - 4pm,,,10:00 – 16:00,10:00 – 16:00,10:00 – 16:00,10:00 – 16:00,10:00 – 16:00,Closed,Closed
8,1ed12605-c696-6bcc-a6fb-3d31c8c1d72d,"Counselling Service for Young People, Newcastle City Council",NE4 6UJ,"(54.97397205, -1.6420005)",Newcastle upon Tyne,0772056094901912733997,https://children-ne.org.uk/how-we-can-help/young-people/counselling/,weyes.counselling@children-ne.org.uk,"If you are struggling with any mental health issues, for whatever reason, we are here to help you.  Our One to One counselling service helps you (as long as you are aged 9 to 25 years old) with your mental health issues. Our friendly counsellors are expertly trained which means we can help you by using a variety of therapy techniques. Whatever the issues affecting your life we are here to help. This includes depression, anxiety, bullying, self-harming, loss and bereavement.  If you don’t want to come to our building then our counsellors can meet you wherever you feel safe and are currently available evenings and Saturday mornings too.  Young Victims of Crime Counselling Service - Did you know that young people are more likely to be victims of crime than adults? Whether you have experienced crime at home, at school or in your local community we can help you if you live in: Newcastle, Gateshead, Sunderland South and West Northumberland and South Tyneside.  We offer a special counselling service for you (as long as you are aged 11 to 25 years old) if you have been a victim of crime. This might include crimes such as domestic abuse, sexual violence or hate crime. This special counselling service helps you to cope and recover from your experience. We offer you the chance to meet other young people who have been through similar experiences to come together, support each other and make new friends.  Information sourced from website: https://www.newcastlesupportdirectory.org.uk/counselling-service-young-people",222041,90288,09:00 – 17:00,09:00 – 17:00,09:00 – 17:00,09:00 – 17:00,09:00 – 17:00,Closed,Closed
9,1ecd756f-f004-60c6-bb77-79166520189d,Celebrate Recovery,"Jesmond Parish Church,Eskdale Terrace,Newcastle upon Tyne,NE2 4DJ","(54.98220599999999, -1.6065152500000002)",Newcastle upon Tyne,01912127424,https://www.jpc.org.uk/groups-events/app/church-life/celebrate-recovery,info@celebraterecovery.org.uk,"We are a 12-Step Christ-centred recovery programme offering support to anyone seeking freedom from any hurt, hang-up or habit.   You are welcome to join us on any Monday. Our weekly meetings run from January to December. If you think Celebrate Recovery might help you, come along to our Monday evening meetings at 7.30pm in church. The General Meeting Night includes Large Group Time with worship and a Bible-based recovery lesson or testimony. This is followed by gender-specific Open Share Groups which follow 5 group guidelines to keep everyone safe.",504491,,19:30 – 21:30,Closed,Closed,Closed,Closed,Closed,Closed
10,1ed038e7-fb04-64d8-b8b1-9966f7251a24,Anxious Minds,"The Vault,31 Station Road,Wallsend,NE28 6SZ","(54.990165000000005, -1.53272925)",Wallsend,01912620305,https://www.anxiousminds.co.uk/,info@anxiousminds.co.uk,"Counselling and Psychotherapy - Counselling and Psychotherapy are talking therapies.   The basis of counselling and psychotherapy is the relationship that is established between the person being supported and their counsellor or psychotherapist. It is essential that the person being treated feels safe and that their counsellor is trusting and non-judgemental and that the person feels they will be met with respect, sensitivity and understanding so that they are free to speak about whatever is on their mind and make a recovery.",1164040,,09:00 – 18:00,09:00 – 18:00,09:00 – 18:00,09:00 – 18:00,09:00 – 18:00,09:00 – 16:00,Closed
11,1ed1a1a9-a29a-62bc-ab02-7f1055b1616a,Unisus Wellbeing,"Salisbury House,,Buddle Street,Wallsend,NE28 6EH","(54.98891020000001, -1.5314682)",Wallsend,01918150340,https://unisus.org.uk/wellbeing,wellbeing@unisus.org.uk,"We provide person centred counselling at our centre in Wallsend and also online. Most of our counsellors are students on placement, who can offer support to those with low level anxiety and depression and is funded for those on low income.   Our associate counsellors are qualified and offer a service to those with higher level needs. This service is provided to those on a low income at a subsidised rate. Counsellors are fully insured and are members of either BACP or NCS.   Our other service is a domiciliary care service so we have experience of working with carer staff, family carers and those with disabilities.",10762096,14137888,09:00 – 17:00,09:00 – 17:00,09:00 – 17:00,09:00 – 17:00,09:00 – 17:00,Closed,Closed
12,1ed18a90-b618-6e54-b936-cf10007b750b,Rollercoaster Support Group,"Durham County Cricket Ground, Riverside,Chester-le-Street,DH3 3QR","(54.84999539999999, -1.56046095)",Chester-le-Street,07377213952,https://www.countydurhamfamilies.info/kb5/durham/fsd/organisation.page?id=2WaSnZuXas8,support@rollercoasterfs.co.uk,"We are a support group for parents/carers who are supporting a child or young person with any kind of emotional or mental health problem including:  anxiety low mood depression self harm eating disorders sleep problems suicidal thoughts obsessions and compulsions  You are not alone! Supporting a child or young person with emotional or mental health issues can be challenging, isolating and sometimes feel like you're riding a real emotional rollercoaster!  Come along to our group, meet other parents/carers in similar situations and get support. There will be guest speakers, discussion topics, practical tips for coping and tea/coffee and biscuits. We meet on the first Wednesday of every month from 10.00am - 12 noon.  Information sourced from website: http://www.countydurhamfamilies.info/kb5/durham/fsd/organisation.page?id=2WaSnZuXas8",,,Closed,Closed,10:00 – 12:00,Closed,Closed,Closed,Closed
13,ba2832fd-5ea6-4f86-b1c3-ce231ce2da75,ARCH Recovery College,"5 St Margaret's Garth,,Durham,DH1 4DS","(54.7752385, -1.5841688500000002)",Durham,,https://www.tewv.nhs.uk/get-involved/training/arch-recovery-college/,tewv.recoverycollege@nhs.net,"ARCH Recovery College is part of Tees, Esk and Wear Valleys NHS Foundation Trust. Mental health service users, carers and staff from County Durham are welcome to enrol with us and take part in a range of courses and workshops designed to support self-understanding and empowerment.  Our courses are developed and taught by people who've been through mental health issues themselves so they really know what they're talking about. We also have small and friendly walking, running and photography groups for anyone who wants to get more active.",,,09:00 – 17:00,09:00 – 17:00,09:00 – 17:00,09:00 – 17:00,09:00 – 17:00,Closed,Closed
14,1eca6cbe-8c79-672a-adfd-5bb0d772eaee,Recovery College Online,,"(None, None)",,,https://lms.recoverycollegeonline.co.uk/,tewv.vrc@nhs.net,"The Recovery College Online provides a range of online educational courses and resources that can be accessed by anyone. There are some courses that are available for guest students to view, however most courses require that you sign up for an account which is quick and easy to do. You must be aged 13 or over to create an account.  The Recovery College Online is for people with experience of mental health issues including service users their family, friends, carers and staff. The courses are co-produced by individuals with personal experience of mental health issues and professionals, this means that the content provides a combined perspective.",,,24 Hours,24 Hours,24 Hours,24 Hours,24 Hours,24 Hours,24 Hours
15,c134c30a-32f8-45c0-8be0-0a6dbd2992ce,St Margarets Centre,"The Old School,Priory Orchard, Margery Lane,Durham,DH1 5QJ","(54.77449929999999, -1.5839211)",Durham,01913848100,https://www.stmargaretscentre.co.uk/,enquiries@stmargaretscentre.co.uk,"St. Margaret’s Centre is an activity, support and training centre for adults suffering from a wide range of mental health problems.  The centre aims to improve the health and wellbeing of the community of County Durham through a wide range of recovery activities, programmes and courses.",1160900,,09:00 – 16:30,09:00 – 16:30,09:00 – 16:30,09:00 – 16:30,09:00 – 16:30,Closed,Closed
16,7fa9ea7a-5488-45c8-8d5b-0ebaf776edbc,Quinn's Retreat,,"(None, None)",,07930678901,https://quinnsretreat.org.uk/,quinnsretreat@gmail.com,"We help Those who have been bereaved by Suicide, those suffering with their mental health and anyone with an INQUEST caseworker by offering them free of charge short breaks at our Caravan in Barnard Castle , County Durham.  In memory of our children Dyllon and Quinn.  REGISTERED CHARITY NO. 1187899.",,,09:00 – 17:00,09:00 – 17:00,09:00 – 17:00,09:00 – 17:00,09:00 – 17:00,Closed,Closed
17,c853cf5a-b71b-42ce-a581-d57d97b98297,Tackle-It Kick Out Stigma,"The Beeches, 4 Mainsfield Close,Giggleswick,Settle,BD24 0ED","(54.0738439, -2.28531585)",Settle,,https://tackleit-kickoutstigma.co.uk/,info@tackle-it.com,"This is a free website non profit making to help raise awareness of mental health issues and to provide some informative coping strategies and help people through their lived experiences.  This website is not just aimed at football but at all sports and the need to help each other with our mental health. Each year there is a World Mental Health Day and a Mental Health week, but every day is a mental health day.  Registered Nurse - Mental Health with the Nursing and Midwifery Council",,,24 Hours,24 Hours,24 Hours,24 Hours,24 Hours,24 Hours,24 Hours
18,df21463f-ad8b-41dd-8aa8-aa9337ad8ba1,Lighthouse Counselling,"Lighthouse Counselling - Emmanuel Church,Warrenhurst road,Fleetwood,FY7 6ST","(53.91986275, -3.0188708)",Fleetwood,01253770646,https://emmanuelfleetwood.org.uk/counselling,lighthouse@emmanuelfleetwood.org.uk,"'Lighthouse' offers counselling across a broad range of mental health issues. We work with individuals, couples, families and teens.  Counsellors are qualified to at least diploma level and are members of either the BACP, ACC or equivalent.  We work within an ethical framework and offer a non-judgemental environment within which you can explore your problems and struggles.  Both male and female counsellors are available, all of whom are volunteers.  To cover its costs Lighthouse works on a donation basis where you decide what you can afford to pay.",1104595,,10:00 – 16:00,10:00 – 16:00,10:00 – 16:00,10:00 – 16:00,10:00 – 16:00,Closed,Closed
19,77d65ff9-3741-4e45-9a02-d98fe17d4d3b,Lighthouse Belfast,"187-189 Duncairn Gardens,Belfast,County Antrim,BT15 2GF","(54.614502200000004, -5.93507585)",Belfast,02890755070,https://www.lighthousecharity.com/,info@lighthousecharity.com,Lighthouse is an organisation committed to the prevention of suicide and self-harm; the promotion of positive mental health and the provision of support services to families who have been bereaved due to suicide.,NIC 102400,,08:30 – 17:00,08:30 – 17:00,08:30 – 17:00,08:30 – 17:00,08:30 – 17:00,Closed,Closed
20,1ed23da1-3b84-625a-840a-6d12c83d17bd,"Protect Life, Start360","6-10 William Street,Belfast,BT1 1PR","(54.6022531, -5.9303797)",Belfast,02890435810,https://www.start360.org/how-can-we-help-you/protect-life,edel.maginn@start360.org,"Protect Life is a service designed to support vulnerable young people who present with issues around self-harm, suicidal ideation and emotional health and well-being.  Interventions provided:  Complimentary therapeutic mentoring support. Situational emotional crisis support Harm reduction. Risk management. Empowering young people to take responsibility for their actions. Supporting young people through agreed action and support plan. De-escalation and risk containment.  Information sourced from website: https://www.start360.org/how-can-we-help-you/protect-life",,NI033207,08:30 – 16:30,08:30 – 16:30,08:30 – 16:30,08:30 – 16:30,08:30 – 16:00,Closed,Closed
21,1eca5df6-17d1-61b0-832c-5b8ccbbbca5e,SELFA,"Ings Primary School,Broughton Road,Skipton,BD23 1TE","(53.95796560000001, -2.0372467500000004)",Skipton,01756533110,https://www.selfa.org.uk/,admin@selfa.org.uk,"**this service is appointment only, please make contact to arrange an appointment**  SELFA is a charity that supports children and families experiencing vulnerabilities to build resilience, thrive and achieve.  We provide health and wellbeing programmes, peer support groups, targeted holiday activities and trips/residential breaks.",1169686,,09:00 – 17:00,09:00 – 17:00,09:00 – 17:00,09:00 – 17:00,Closed,Closed,Closed
22,4a201b4a-1df6-4e78-8c80-453a7e30c411,Central Lancashire Haven,"Central Lancashire Haven,Blanche Street,Preston,PR2 2RL","(53.76466965, -2.72233105)",Preston,03300083672,https://www.richmondfellowship.org.uk/how-we-can-help-new/find-a-service/blackpool/central-lancashire-haven/,centrallancashirehaven@richmondfellowship.org.uk,"Central Lancashire Haven part of the Richmond Fellowship charity. is a short term mental health service for people in crisis who are registered with a GP in the Preston, Chorley and South Ribble area.   The Haven offers up to 4 therapeutic intervention sessions for a variety of mental health issues e.g. anxiety, self esteem, low mood. These therapeutic interventions aim to give individuals the coping strategies they need to be able to manage their mental health themselves and prevent future crisis.  The Haven can be accessed by self-referral or by referral from another service, and is open every day of the year.  Information updated from website.",200453,,10:00 – 22:00,10:00 – 22:00,10:00 – 22:00,10:00 – 22:00,10:00 – 22:00,11:00 – 22:00,11:00 – 22:00
23,1ed5227a-d7d1-6746-a32e-0fc0d188cf3a,The Butterfly and Phoenix Project,"Lancashire,PR2 2YF","(53.75925475, -2.729915)",Preston,03450138208,https://www.butterflyandphoenix.org/,admin@n-compass.org.uk,"We are a team of counsellors supporting young people aged 11-18 in various areas across Lancashire. As part of n-compass, we are a trusted service with over 10 years’ experience in support and advice. We work across Fylde, Preston, South Ribble, Chorley.  You can talk to your counsellor about anything you want to. All our team are experienced, qualified and will not judge you on how you are feeling. We have supported young people with lots of issues, so you will not be alone and not the first person to ever feel like you do. We can support you through exam stress, bullying, feeling sad, sexuality, worry, family problems and self-harm. Anything that is troubling you, you can talk to our counsellors about.  Information sourced from website: https://www.butterflyandphoenix.org/",1128809,06845210,09:00 – 17:00,09:00 – 17:00,09:00 – 17:00,09:00 – 17:00,09:00 – 17:00,Closed,Closed
24,1ece7efa-91cf-6a56-8962-473484d8b37a,Brighter Lives North West,"Valley Street Community Centre,Burnley,BB11 5LZ","(53.781748449999995, -2.2749471499999996)",Burnley,07925726855,https://brighterlivesnorthwest.co.uk/,contact@brighterlivesnorthwest.co.uk,"Brighter Lives North West is a community interest company based at Valley Street Community Centre in Burnley. Alongside a great team of fully trained volunteers, we are here to support children, young people and adults from Burnley and Padiham in all aspects of their lives. Whether it’s our Young People’s Groups where we discuss topics such as bullying or self-harm, or a one to one session where we offer advice and support on domestic abuse or mental health needs, we work with between 250-300 children and young people and between 40-60 adults a year.  You are not alone.  All of our services are bespoke to each individual’s needs. We understand that everyone is unique and they need the best intervention suited to them, so once we have done our initial assessments we develop our sessions on a weekly basis depending on where a person is up to at that time. We also understand that sometimes people just need to talk, so we sit, listen and give the best advice we can. Brighter Lives North West is a friendly place where you will feel safe and welcome amongst like minded individuals. If you feel that we could help you or you know someone who you would like to refer to us, please contact us either via the form here or give us a call on 07925 726855 from Monday to Friday between 9am-5pm.  We offer practical and emotional support around the impact of domestic and sexual abuse to both children and young people and adults. This can be historical or current abuse. We are here to help and empower you.  Young Peoples Services - We run a Young People’s group every Tuesday from 5:30pm-7:00pm. We also offer a 1-1 drop in service after group until 8:00pm. During the first 45 minutes of group time we explore different topics of the young people’s choice (e.g. self-harm, abuse, anxiety, depression, healthy relationships). Then in the second half we do an activity based on the topic we discussed.  Information sourced from website: https://brighterlivesnorthwest.co.uk/",,10918056,09:00 – 17:00,09:00 – 17:00,09:00 – 17:00,09:00 – 17:00,09:00 – 17:00,Closed,Closed
25,e807261b-dcdc-4d36-b173-581043d9d6eb,Rainbow Youth Centre,"23 blackburn rovers business centre,ewood park,bb2 4jf","(53.7276813, -2.4886458)",Blackburn,01254720740,https://www.rainbowyouthcentre.com/,office@rainbowyouthcentre.com,We help under 18s who identify as LGBTQ+ who need a safe space to go to meet friends and seek advice and support.,,12465973,Closed,Closed,Closed,Closed,Closed,10:00 – 17:00,Closed
26,1ecc1641-5434-677e-9aa5-05f42e96f21e,Southport Crisis Cafe,"Alchemy,Mornington Road,Southport,PR9 0TS","(53.64747615, -2.9973764000000003)",Southport,03003230197,https://seftoncvs.org.uk/project/crisis-cafe/,crisiscafe@seftoncvs.org.uk,"We provide support during a mental health crisis, signpost to services, support your recovery and improve your wellbeing.",1024546,2832920,Closed,Closed,Closed,Closed,17:00 – 23:00,17:00 – 23:00,17:00 – 23:00
27,f02fdc0a-37e8-44fd-81d3-e5463e104ed7,Mental Health Urgent Response Team,,"(None, None)",,08000513253,https://www.gmmh.nhs.uk/mental-health-urgent-response-team,,"Our Mental Health Urgent Response Team provides specialist assessment, advice and signposting for adults with moderate, severe and enduring symptoms of mental illness such as severe depression and anxiety, as well as conditions like schizophrenia and bipolar disorder.     Our team is available 24 hours a day, seven days a week, 365 days a year.",,,24 Hours,24 Hours,24 Hours,24 Hours,24 Hours,24 Hours,24 Hours
28,388f7ec4-3d98-49de-a860-cabc065f50e8,"BAND, Family Action","Unit 9C Market Place,Knowsley Street,Bolton,BL1 2AL","(53.58088205, -2.4301688500000003)",Bolton,01204380643,https://www.family-action.org.uk/what-we-do/adult-mental-health-and-wellbeing/band/,band@family-action.org.uk,"One to one and group support.   Befriending, peer support, social and shared interest groups. Friendly and welcoming.",264713,,09:00 – 17:00,09:00 – 17:00,09:00 – 17:00,09:00 – 17:00,09:00 – 17:00,Closed,Closed
