,id,name,address,coor,city,phone,website,email,description,charity_number,company_number,Monday,Tuesday,Wednesday,Thursday,Friday,Saturday,Sunday
138,b8e7af6c-7c0b-40c5-96cb-ef951bf0592c,Kooth,,"(None, None)",,,https://www.kooth.com/,,"Kooth is a free, safe and anonymous online mental health service.   We are available to use 24/7 and 365 days a year. Here's what you can access anytime. Discussion boards live forums  helpful articles  Self help tools (Journals and Goal Tracking) Our professional support live chat availability times are as follows: Monday to Friday: 12pm - 10pm Saturday and Sunday 6pm - 10pm Hours may vary during the Christmas period, new year period and bank holidays.  We are commissioned by the NHS, charities, local authorities, and businesses and a BACP accredited service. We provide free online counselling, a safe and supportive community with peer-led support, along with self-help and wellbeing tools for children and young people.  All of our counsellors are trained, qualified and used to working with young people. As a service Kooth is self-referral based with no waiting lists or criteria needed to access our support.  Our community is friendly, supportive and inclusive. In the Kooth Community, you can receive peer-led support from other young people on our Live Forums, Discussion Boards, and Magazine or share advice and express yourself in a safe space.  Self-help and wellbeing tools such as the Kooth Journal, Goal Setting and 22 different Mini-Activities are also there to support you and your wellbeing. All of our support can be accessed at www.kooth.com",,12526594,24 Hours,24 Hours,24 Hours,24 Hours,24 Hours,24 Hours,24 Hours
139,ce1727b5-6fc9-4b13-ab63-6fb1bdf20d13,MenWalkTalk,,"(None, None)",,,https://menwalktalk.co.uk/,hello@menwalktalk.co.uk,"MenWalkTalk support, organise and deliver Walk & Talk groups for Men aged over 18 across England, Facilitated by a trained Volunteer 'Walk-Leader'.   Groups are designed to be safe spaces for Men to meet other guys, support one another and find ways to better manage any mental health worries. Safeguarding is important to MenWalkTalk, and MenWalkTalk is not a crisis support organisation but volunteers will always offer safety planning for guys who appear to be in crisis.",1188361,,Closed,Closed,Closed,Closed,Closed,10:00 – 12:30,Closed
140,e17e3d2f-8fed-4c63-b358-db7bc947bf2e,CALM (Campaign Against Living Miserably),,"(None, None)",,0800585858,https://thecalmzone.net/,,"Campaign Against Living Miserably (CALM) is leading a movement against suicide through vital, life-saving support, impactful campaigns and collective action.  Our Helpline and Webchat are open 5pm – midnight 365 days a year, and we can talk to you about whatever is getting you down.  These are free, anonymous and confidential services. Calls & Chats are taken by trained staff who are there to listen, support, inform and signpost.",1110621,,17:00 – 23:59,17:00 – 23:59,17:00 – 23:59,17:00 – 23:59,17:00 – 23:59,17:00 – 23:59,17:00 – 23:59
141,ef5225cc-d1ea-4ad6-8d78-d48a7e9de787,Sport in Mind Buckinghamshire,,"(None, None)",,01189479762,https://www.sportinmind.org/,info@sportinmind.org,"Sport in Mind groups offer a wide range of sports and physical activities to suit everyone, regardless of age, gender, mobility, ethnicity sexual orientation or ability and open to anyone over 17 experiencing mental health problems as well as carers. All our groups are delivered in a safe, supportive and fun environment and take place on the same day at the same time every week at various locations, so to find which session is closest to you, please check out our website www.sportinmind.org. We deliver lots of different activities, including: walking, dance and movement, gardening, table tennis, football, yoga, Tai Chi, badminton plus more, as well as any of the equipment too. The sessions are drop-in, so there is no need to book in advance or be referred and we welcome you to bring a family member or friend along with you to join in for your first few sessions.  Sport in Mind Is the UK’s leading mental health sports charity Works in partnership with the amazing NHS in order to aid recovery, promote mental wellbeing, improve physical health, combat social isolation and empower people to move their lives forward in a positive direction.  If you have any questions, please get in touch, we would love to hear from you.",1161323,,24 Hours,Closed,Closed,Closed,Closed,Closed,Closed
142,fd01af1e-2525-48e9-b8a8-30fac370dc94,Warriorkind,,"(None, None)",,,https://warriorkind.co.uk/,hello@warriorkind.co.uk,WarriorKind® is a community dedicated to normalising conversations around mental health and well being.   The WarriorKind® community was built on our safe spaces where our members unite whilst sharing their stories and supporting each other. If you would like to become part of an empowering and inspirational community then please feel free to join one of our groups.  Updated from website: https://warriorkind.co.uk/,,12507364,24 Hours,24 Hours,24 Hours,24 Hours,24 Hours,24 Hours,24 Hours
143,08971205-35ff-4720-82f9-1ca3fa0ccd72,Julian Campbell Foundation,,"(None, None)",,02083640429,https://juliancampbellfoundation.org/,info@juliancampbellfoundation.org,"The Julian Campbell Foundation is a charity set up to help children, teenagers and young adults who have undiagnosed forms of mental distress such as stress, anxiety or depression. Our purpose is to raise awareness of mental health difficulties amongst young people. Our aim is to identify and support young people experiencing mental health difficulties to reach their academic and social potential. We do this by providing mood management strategies alongside a mentoring service.  We have a spectrum of experience from high risk mentees of self harmers and suicide attempts to low risk issues with relationships at home/school. In addition we use mood maps to help identify a young person's mood and to formalise a strategy to go where they want to be on a therapeutic basis. Our charity can conduct those sessions either online or face-to-face.",1140206,06972092,Closed,09:00 – 14:30,09:00 – 14:30,09:00 – 14:30,Closed,Closed,Closed
144,1ecae85b-cd85-6ec6-8bf2-c1ab4b2475c0,Brighter Futures - Self Harm Support and Recovery,,"(None, None)",,07824505538,https://www.brighter-futures.org.uk/self-harm-support-recovery/,info@brighter-futures.org.uk,"Our Self-Harm Support and Recovery service offers support for anyone aged over 18 in Staffordshire who are living with self-harm or who has experienced suicidal thoughts at the point when a hospital visit or admission is neither wanted or needed.  How can Self-Harm Support and Recovery help me? Support will be tailored to each person’s needs. We will help develop new ways to cope and to reduce any isolation experienced. Support might include:  Tailored 1-2-1 support of up to six sessions at each person’s preferred pace.  A recovery plan developed with a dedicated support worker as part of a 1-2-1 support plan. Activities such as therapeutic art, crafts and mindfulness. Relaxation and distraction techniques. Social groups to help meet new people and share hobbies and interests with. Telephone support calls to provide out of hours support when many other services are closed.",,,09:00 – 17:00,09:00 – 17:00,09:00 – 17:00,09:00 – 17:00,09:00 – 17:00,Closed,Closed
145,1ecb67ec-10ef-64ae-95e8-ad64363c484d,Penumbra,,"(None, None)",,01382223487,https://www.penumbra.org.uk/about-us/,,"We are Penumbra Mental Health, a pioneering charity providing dedicated services for people with mild to serious and enduring mental ill health.  We support people on their journey to better mental health, by working with each person to find their own way forward. The power of people’s lived experience enables us to provide pioneering services which transform lives.",SC010387,,09:00 – 17:00,09:00 – 17:00,09:00 – 17:00,09:00 – 17:00,09:00 – 17:00,Closed,Closed
146,1ece7ce2-8ad4-6df6-aa56-5f4a72a744fe,Muslim Women's Network,,"(None, None)",,01212369000,https://www.mwnhelpline.co.uk/,info@mwnhelpline.co.uk,"The helpline is a national specialist faith and culturally sensitive service that is confidential and non-judgmental, which offers information, support, guidance and referrals. We also provide holistic in depth support via case-workers for complex cases where service users need ongoing support which could last weeks or months. The helpline also acts as an interface or conduit between the victims and other specialist that can also provide support. Although, our service users are primarily Muslim women and girls, we also provide support to men (5% of callers) and to women of other faiths and no faith (e.g. 4%).   We provide help on about 43 issues. Two thirds of our service users contact us about different forms of abuse such as domestic abuse, honour-based abuse, forced marriage, sexual abuse, sexual harassment, stalking and revenge porn. Most callers also contact us about more than one issue. Half of callers also want help for their mental health such as for anxiety, depression, post-traumatic stress, self harm, suicidal thoughts and loneliness. For these callers we are able to make internal referrals to our counselling service or to try and identify local services in their areas.   Phone: 10am to 4pm (Mon To Fri) 0800 999 5786 (free from mobiles and landlines) 0741 520 6936 (Usual call rates apply) Text us 07415 206 936",1155092,,10:00 – 16:00,10:00 – 16:00,10:00 – 16:00,10:00 – 16:00,10:00 – 16:00,Closed,Closed
147,1ed09cb1-e056-6c8e-8c44-bb272bf27d61,Togetherall (North Cumbria),,"(None, None)",,02034056196,https://togetherall.com/en-gb/,theteam@togetherall.com,Togetherall is a free and anonymous online community available 24/7 to all residents aged 16+ living in North Cumbria looking for mental health support and a sense of connection.,,06227377,24 Hours,24 Hours,24 Hours,24 Hours,24 Hours,24 Hours,24 Hours
148,1ed0f302-f36b-6c46-8f61-4595000267fc,"ChatHealth, Sussex Community NHS Foundation Trust",,"(None, None)",,0748063542407480635423,https://www.sussexcommunity.nhs.uk/services/chathealth-text-messaging-service/108923,,"ChatHealth is a secure and confidential text messaging service for young people, aged 11-19. It provides an easy and anonymous access with a healthcare professional for advice and support.  The service provides information about sensitive issues on:  stress and anxiety bullying self-harm alcohol and drugs sex, contraception and relationships sensitive issues any other health matters you are concerned about  Texts will be responded to by the school nursing team within one working day.  The service also provides more information about accessing other local services including getting help with emotional health, weight management and healthy relationships.  If you live in West Sussex, you can text 07480 635424. If you live in Brighton & Hove, you can text 07480 635423. Opening Hours: Monday to Friday, 9am - 4.30pm excluding bank holidays. Outside of these hours, an automated message is sent with advice on where to get help if the question is urgent.  Information sourced from website: https://www.sussexcommunity.nhs.uk/services/chathealth-text-messaging-service/108923",,,09:00 – 16:30,09:00 – 16:30,09:00 – 16:30,09:00 – 16:30,09:00 – 16:30,Closed,Closed
149,1ed0f384-f928-62d8-840f-619f07b45db9,Outside Edge Theatre Company,"Brady Arts & Community Centre,192-196 Hanbury Street,E1 5HU","(51.5196179, -0.0653927)",London,02073718020,https://edgetc.org/,admin@edgetc.org,"""OETC is the UK’s only theatre company and participatory arts charity focusedon helping people affected by addiction and mental health.   We deliver FREE drama and creative writing workshops that help improve wellbeing and support recovery maintenance. Our creative activities focus on the Five Ways to Wellbeing.  Anyone *affected by* addiction can join our groups.  ""AT OUR GROUPS YOU:  > Build confidence > Create a safe network of peer-support > Have fun > Develop focus and commitment > Foster personal creativity > Increase Recovery Capital > Focus on the Five Ways to Wellbeing   Link to our weekly activities: http://edgetc.org/monthly-schedule-of-activities/""",1080948,03871591,18:00 – 20:00,15:30 – 20:30,15:30 – 20:30,12:30 – 14:30,13:00 – 20:30,Closed,Closed
150,8ce63427-80a8-4e32-9e3b-e75a1635c4e1,Richmond Fellowship,,"(None, None)",,01514826140,https://www.richmondfellowship.org.uk/,,We support people in crisis via our Walk-In services through to Crisis and Supported Housing.,200453,662712,11:00 – 22:00,11:00 – 22:00,11:00 – 22:00,11:00 – 22:00,11:00 – 22:00,11:00 – 14:00,Closed
151,10ea9da2-0abf-4c3b-91ae-825ed9122113,The Laura Hyde Foundation,,"(None, None)",,,https://laurahydefoundation.org/,thelaurahydefoundation@gmail.com,LHF's objective is to ensure that all medical and emergency services personnel have access to the best mental health support network available. Our carers need caring for too.   Talking therapies are one of the most effective ways of dealing with your Mental Health. The Laura Hyde Foundation can offer guidance and support to anybody who requires it. We can't always deal with life on our own..... Share the load.  Updated from website: https://laurahydefoundation.org/,1190944,,24 Hours,24 Hours,24 Hours,24 Hours,24 Hours,24 Hours,24 Hours
152,16f59c98-58cd-431d-bfbc-9b1b31ffdc31,SupportLine,,"(None, None)",,01708765222,https://www.supportline.org.uk/,info@supportline.org.uk,"SupportLine provides a confidential telephone helpline offering emotional support to any individual on any issue. The Helpline is primarily a preventative service and aims to support people before they reach the point of crisis.  SupportLine is open to any individual of any age. Calls are received from children, young adults and adults.  SupportLine is able to take calls on a wide range of issues including relationships, child abuse, anger, bullying, eating disorders, exam stress, self harm, domestic violence, rape and sexual assault, disability, mental health, depression, anxiety, panic attacks, addictions, debt, phobias, conflict, sexuality, health concerns, homelessness, racial harassment, loneliness.  We also offer an email support service which is open every day and the charity aims to respond within forty eight hours to emails.",1097419,,Closed,18:00 – 20:00,18:00 – 20:00,18:00 – 20:00,Closed,Closed,Closed
153,1eb14e3a-f83d-4907-ab4a-1678ec1f5976,SANEline,,"(None, None)",,03003047000,https://www.sane.org.uk/,support@sane.org.uk,"SANEline is a national out-of-hours mental health helpline offering specialist emotional support, guidance and information to anyone affected by mental illness, including family, friends and carers. We are normally open every day of the year from 4pm to 10pm on 0300 304 7000.  Our helpline is here to support you – particularly if you feel you have reached a moment of crisis. We know that moment of crisis is different for everybody – some people can reach that point daily, and for some people it is a rare occurrence.  SANEline is open between 4pm to 10pm, 365 days a year.  Information updated from website: https://www.sane.org.uk/how-we-help/emotional-support/saneline-services",296572,,16:00 – 22:00,16:00 – 22:00,16:00 – 22:00,16:00 – 22:00,16:00 – 22:00,16:00 – 22:00,16:00 – 22:00
154,865b7651-1803-4d6f-bc61-81aec505ed42,SAPChat,,"(None, None)",,03003650727,https://www.suicideapuk.co.uk/,danielle@suicideapuk.co.uk,"We help anyone struggling with suicidal idealization. All of our volunteers are suicide prevention trained.  Open 7 days a week on our SAPChat service via Facebook Messenger, website and Instagram.  We have closed our phone line temporarily till after the new years but we are still running our recovery plan, which is where people are enrolled to, to receive weekly phone calls of support as well as access to the message line.",,CIC,09:00 – 23:00,09:00 – 23:00,08:00 – 23:00,08:00 – 20:00,14:00 – 23:00,08:00 – 23:00,08:00 – 23:00
155,87b147bc-476a-401b-9344-4aeafd744f19,Qwell,,"(None, None)",,,https://www.qwell.io/,contact@kooth.com,"Online emotional wellbeing and mental health support. Relate and connect with others by sharing similar experiences, and gain valuable self- care tips and tools from our engaged community and professional team.  We are available to use 24/7 and 365 days a year. Here's what you can access anytime. Discussion boards live forums  helpful articles  Self help tools (Journals and Goal Tracking) Our professional support live chat availability times are as follows: Monday to Friday: 12pm - 10pm Saturday and Sunday 6pm - 10pm Hours may vary during the Christmas period, new year period and bank holidays.  Our team of professionals aim to provide early response to emotional wellbeing as well as emerging mental health needs via our online platform and counselling sessions. BACP and UKCP Accredited.",,12526594,24 Hours,24 Hours,24 Hours,24 Hours,24 Hours,24 Hours,24 Hours
156,88964de0-cb7f-4aa2-9d8a-67232c7bbf7b,Tough Enough To Care,,"(None, None)",,,https://toughenoughtocare.help/,info@toughenoughtocare.org,"We want men of all ages to feel comfortable talking and opening up about their emotions to those close to them, instead of bottling them up until they reach breaking point. We also want men to be able to spot when others may be struggling.   There is no shame in being Tough Enough To Care.  Updated from website: https://toughenoughtocare.help/",1187404,,24 Hours,24 Hours,24 Hours,24 Hours,24 Hours,24 Hours,24 Hours
157,8ab0809e-b309-4a96-ad30-a5aec2aecb96,Self Injury Support,,"(None, None)",,01179279600,https://www.selfinjurysupport.org.uk/,info@selfinjurysupport.org.uk,"Helpline and text, email and web chat support for women of all ages affected by self-harm.   That anyone who uses self-injury knows they are not alone; that everyone understands that self-injury is a complex and important issue we should all care about; and that together we tackle both the causes and stigma of self-injury.  ESS: Text and Email Support Service for girls and young women up to 24 affected by self-injury. Text: 0780 047 2908.",1092299,,Closed,19:00 – 21:30,19:00 – 21:30,19:00 – 21:30,Closed,Closed,Closed
158,a93d2850-4f5e-41a5-93f8-2a81ca25cc26,The Lily Jo Project,,"(None, None)",,07852577974,https://www.thelilyjoproject.com/,admin@thelilyjoproject.com,"Online mental health resource.   On our site you will find information and help on common mental health issues including: depression, anxiety, self-harm, eating disorders, childhood trauma, self-esteem, and grief.",11603746,,24 Hours,24 Hours,24 Hours,24 Hours,24 Hours,24 Hours,24 Hours
159,aa1daa53-bbd0-4a7e-a6b8-5c18b27936cd,Harmless,,"(None, None)",,,https://www.harmless.org.uk/,info@harmless.org.uk,Harmless is an organisation who works to address and overcome issues related to self-harm and suicide.  We believe in hope and recovery.   We place people with lived experience at the heart of our service and do our very best to surround the people we help with compassion and practical help and support to bring about measurable and meaningful change. We deliver a range of different services at various locations. You can have a look at which service is being delivered at a location near you before referring into service or requesting support.,,07150904,09:00 – 17:00,09:00 – 17:00,09:00 – 17:00,09:00 – 17:00,09:00 – 17:00,Closed,Closed
160,c1fa611a-c4b3-46f4-94cb-553d3f6b7f92,Lifeline,,"(None, None)",,08088088000,https://www.lifelinehelpline.info/index.html,,"Lifeline counsellors are available 24 hours a day, seven days a week to listen and help, in confidence.  Lifeline counsellors are experienced in working with trauma, suicide, self-harm, abuse, depression and anxiety. You will receive immediate help on the phone. Should you need further support we can provide a face-to-face counselling appointment in your local area within seven days.  Lifeline also provides support and guidance to families and carers, concerned friends, professionals, teachers, youth workers, clergy and communities. Remember, Lifeline is available 24 hours a day, seven days a week. Just call 0808 808 8000. Deaf and hard of hearing Textphone Users: 180001 0808 808 8000.  The Lifeline helpline is funded by the Department of Health, Social Services and Public Safety for people living in Northern Ireland as part of Protect Life – A shared vision, the suicide prevention strategy for Northern Ireland. Lifeline counsellors are professionally qualified with a Diploma in Counselling and hold British Association of Counselling and Psychotherapy (BACP) membership. Lifeline counsellors receive specialist trauma training, clinical supervision and support to ensure they can help all callers effectively.",,,24 Hours,24 Hours,24 Hours,24 Hours,24 Hours,24 Hours,24 Hours
161,ce59e8e8-0ff9-459d-b8c2-6673dbb38a48,Youth Mental Health Foundation,,"(None, None)",,07588792474,https://www.youthmentalhealthfoundation.org/,parentsupport@youthmentalhealthfoundation.org,The Youth Mental Health Foundation C.I.C. is a not-for-profit organisation that delivers projects to support young people’s mental health.  Our free online course guides parent of young people who self-harm to play a key role supporting their child’s recovery.,,13515864,09:00 – 17:00,09:00 – 17:00,09:00 – 17:00,09:00 – 17:00,09:00 – 17:00,Closed,Closed
162,dc93fc86-e2fb-4693-aef6-0c95a49e3ef4,Parenting Mental Health,,"(None, None)",,,https://www.facebook.com/groups/parentingmentalhealth,info@parentingmentalhealth.com,"Parenting Mental Health is a UK based charity, website and Facebook online support group that supports parents/carers globally 24/7.   We understand the challenges faced when caring for a child (of any age; child or adult) with poor mental health and we are here to support you with a wealth of lived experience so you feel less alone, heard, valued, supported, and empowered.   We offer; free emotional support to parents/carers, events, courses, listening circles, and connection with others in a similar position. Within this unique safe space you will be met with understanding, compassion and empathy from people who ""get it"".   Website - https://parentingmentalhealth.org/  Parenting Mental Health is a registered charity in England and Wales - Number 1188036.",,,24 Hours,24 Hours,24 Hours,24 Hours,24 Hours,24 Hours,24 Hours
163,e01905a0-c1db-4729-afbf-9a337bd30fe7,Holding Space,,"(None, None)",,01323315005,https://www.holdingspace.org.uk/,contact@holdingspace.org.uk,"We provide mental health support for families (parents, carers, children) who are supporting a family member with mental illness. We provide a safe, confidential, non judgemental space for parents and carers to meet, connect, chat, share and be supported.   We believe that education, supporting and empowering families is crucial to the recovery and mental health of the next generation and we do this by offering support and a range of interventions through our team of professionals.   We offer face to face, online and telephone support.  Information sourced from holdingspace.org.uk",1194399,,09:00 – 18:00,09:00 – 18:00,09:00 – 18:00,09:00 – 18:00,09:00 – 17:00,Closed,Closed
164,305f7449-bada-4717-923d-c9529a0aef72,The Mix,,"(None, None)",,08088084994,https://www.themix.org.uk/,info@themix.org.uk,"The Mix is a support service for young people. We are here to help you take on any challenge you’re facing - from mental health to money, from homelessness to finding a job, from break-ups to drugs.   You can call our helpline which is open 4pm-11pm every day and also Text THEMIX to 85258 (24/7). You can also email us and we have a one-to-one chat message service.  Information updated from website: https://www.themix.org.uk/get-support",1048995,,16:00 – 23:00,16:00 – 23:00,16:00 – 23:00,16:00 – 23:00,16:00 – 23:00,16:00 – 23:00,16:00 – 23:00
165,3bf331d7-caf8-4f10-bfe7-f41247a90be1,Liverpool CAMHS,,"(None, None)",,08081963550,https://www.liverpoolcamhs.com/need-advice/anxiety/,crisiscare@alderhey.nhs.uk,"Here at Sefton & Liverpool CAMHS we work with children and young people to help you make sense of any mental health and emotional wellbeing challenges you might be facing.  At this stage, your information will be shared with clinicians as they assess what type of support you might need, so be as honest as you can. If you tell us that you are at risk of significant harm, we may have to share this information with other agencies as your safety is what is most important to us.  The online referral form has five sections. If you create an account you can save your progress as you go through the form.  Information updated from website: https://www.liverpoolcamhs.com/need-advice/anxiety/",,,24 Hours,24 Hours,24 Hours,24 Hours,24 Hours,24 Hours,24 Hours
